{
  "specVersion": "0.1",
  "id": "rli_pyreturn",
  "engagementId": "eng_brightside_2025",
  "label": "Prior-year tax return (2024)",
  "description": "Full copy of the 2024 federal and state returns as filed, including all schedules.",
  "itemType": "document",
  "category": "prior-year",
  "status": "received",
  "required": true,
  "dueDate": "2026-02-15",
  "requestedFrom": { "id": "cli_brightside_owner", "name": "Robin Cole", "role": "client-contact" },
  "remindersSent": 1,
  "receivedAt": "2026-02-12T19:02:00Z",
  "attachments": [
    {
      "id": "att_2024_return",
      "filename": "brightside-2024-return.pdf",
      "contentType": "application/pdf"
    }
  ]
}
